{
  "ticker": "AAPL",
  "output_mode": "D",
  "check_timestamp": "2026-03-28T01:15:00Z",
  "overall_result": "FAIL",
  "core_overall_result": "PASS",
  "run_context": {
    "run_id": "20260328T000000Z_AAPL_D_FIXTURE",
    "artifact_root": "output/runs/20260328T000000Z_AAPL_D_FIXTURE/AAPL",
    "ticker": "AAPL"
  },
  "items": {
    "financial_consistency": {
      "status": "PASS"
    },
    "price_and_date": {
      "status": "PASS"
    },
    "blank_over_wrong": {
      "status": "PASS"
    },
    "contract_validation": {
      "status": "PASS"
    },
    "semantic_consistency": {
      "status": "PASS"
    },
    "verdict_policy": {
      "status": "PASS"
    },
    "cross_artifact_consistency": {
      "status": "PASS"
    }
  },
  "delivery_gate": {
    "result": "BLOCKED",
    "ready_for_delivery": false,
    "blocking_items": [
      "critic_review"
    ],
    "non_blocking_items": [],
    "historical_only_items": [],
    "critic_overall": "FAIL",
    "critic_delivery_impact": "delivery_blocking_flag"
  },
  "critic_review": {
    "reviewer": "critic-agent",
    "review_timestamp": "2026-03-28T01:20:00Z",
    "overall": "FAIL",
    "items": [
      {
        "item": "generic_test",
        "status": "PASS",
        "section": "Section 4 — Variant View",
        "notes": "Company-specific evidence is cited."
      },
      {
        "item": "mechanism_test",
        "status": "FAIL",
        "section": "Section 5 — Precision Risk",
        "problem": "Regulatory risk lacks quantified stock-price transmission.",
        "fix": "Add the revenue, EBITDA, and multiple-compression chain for the downside case."
      },
      {
        "item": "scenario_consistency",
        "status": "PASS"
      },
      {
        "item": "math_consistency",
        "status": "PASS"
      },
      {
        "item": "completeness",
        "status": "FAIL",
        "section": "Section 9 — Quality of Earnings",
        "problem": "EBITDA Bridge table is missing.",
        "fix": "Add EBITDA Bridge and FCF conversion commentary."
      }
    ]
  },
  "feedback_for_analyst": [
    {
      "section": "Section 5 — Precision Risk",
      "problem": "Regulatory risk lacks quantified stock-price transmission.",
      "fix": "Add the revenue, EBITDA, and multiple-compression chain for the downside case."
    },
    {
      "section": "Section 9 — Quality of Earnings",
      "problem": "EBITDA Bridge table is missing.",
      "fix": "Add EBITDA Bridge and FCF conversion commentary."
    }
  ],
  "auto_fixes_applied": [],
  "inline_flags_added": [],
  "generated_by": "quality-report-builder"
}
