{
  "ticker": "AAPL",
  "output_mode": "D",
  "check_timestamp": "2026-03-28T01:15:00Z",
  "overall_result": "PASS",
  "core_overall_result": "PASS",
  "run_context": {
    "run_id": "20260328T000000Z_AAPL_D_FIXTURE",
    "artifact_root": "output/runs/20260328T000000Z_AAPL_D_FIXTURE/AAPL",
    "ticker": "AAPL"
  },
  "items": {
    "financial_consistency": {
      "status": "PASS"
    },
    "price_and_date": {
      "status": "PASS"
    },
    "blank_over_wrong": {
      "status": "PASS"
    },
    "contract_validation": {
      "status": "PASS"
    },
    "semantic_consistency": {
      "status": "PASS"
    },
    "verdict_policy": {
      "status": "PASS"
    },
    "cross_artifact_consistency": {
      "status": "PASS"
    }
  },
  "delivery_gate": {
    "result": "PASS",
    "ready_for_delivery": true,
    "blocking_items": [],
    "non_blocking_items": [],
    "historical_only_items": [],
    "critic_overall": "PASS",
    "critic_delivery_impact": "none"
  },
  "critic_review": {
    "reviewer": "critic-agent",
    "review_timestamp": "2026-03-28T01:40:00Z",
    "overall": "PASS",
    "items": [
      {
        "item": "generic_test",
        "status": "PASS",
        "section": "Section 4 — Variant View",
        "notes": "Company-specific evidence is cited."
      },
      {
        "item": "mechanism_test",
        "status": "PASS",
        "section": "Section 5 — Precision Risk",
        "notes": "Downside chain now quantifies the revenue, EBITDA, and multiple impact."
      }
    ],
    "recheck_count": 1,
    "recheck_history": [
      {
        "review_timestamp": "2026-03-28T01:40:00Z",
        "updated_items": [
          "mechanism_test"
        ],
        "remaining_fail_items": []
      }
    ]
  },
  "auto_fixes_applied": [],
  "inline_flags_added": [],
  "generated_by": "quality-report-builder"
}
